{
  "id": "TI-02",
  "phase": 5,
  "slug": "floor-tile-installation",
  "title": "Floor Tile Installation",
  "category": "Tile Work Advanced",
  "level": "Journeyman",
  "priority": 4,
  "status": "todo",
  "sections": [],
  "checklists": [],
  "quiz": {
    "passing_score": 0.8,
    "questions": []
  }
}